ID select,verbe,id Frantext,auteur,titre,intervale tps,date,page,ctx gauche,mot gauche,ponct G,pivot,ponct D,mot droit,ctx droit
264,illustrer,24,ROUSSEL Raymond,Locus Solus,1910-1919,1914,261,lui remit plusieurs traités d' entomologie,bien,,illustrés,",",qu',elle put feuilleter à loisir . Après diverses
265,illustrer,25,CARCO Francis,Jésus-la-Caille,1910-1919,1914,15,costauds reconnus par tous . Son adresse au couteau,l',,illustra,.,Il,devint un grand et solide maquereau . Sa gloire
266,illustrer,26,BARBUSSE Henri,Le Feu,1910-1919,1916,23,; son frère Joseph vendait des journaux et des,romans,,illustrés,,dans,"une gare du réseau de l' état , tandis que , loin"
267,illustrer,27,PROUST Marcel,À la recherche du temps perdu. 4. À l'ombre des jeunes filles en fleurs,1910-1919,1918,455,est d' un même temps se ressemble ; les artistes,qui,,illustrent,,les,poèmes d' une époque sont les mêmes que font
268,illustrer,28,PROUST Marcel,À la recherche du temps perdu. 5. À l'ombre des jeunes filles en fleurs,1910-1919,1918,576,villes ) : les éditions d' histoire de la,peinture,,illustrées,",",les,"concerts symphoniques et les études sur les """
269,illustrer,29,PROUST Marcel,À la recherche du temps perdu. 6. À l'ombre des jeunes filles en fleurs,1910-1919,1918,838,"exemple , telle de ces photographies "" magnifiques","""",,illustrera,,une,"loi de la perspective , nous montrera telle"
270,illustrer,30,FRANCE Anatole,Le Petit Pierre,1910-1919,1918,51,et d' incrédulité les affirmations,toujours,,illustrées,,d',exemples que lui faisait cet éloquent épicier .
271,illustrer,31,FRANCE Anatole,Le Petit Pierre,1910-1919,1918,158,autrefois papegai ou papegaut . Ce que mon,parrain,,illustra,,par,"cet exemple : - gai comme un papegai , dit Rabelais ."
272,illustrer,44,GIRAUDOUX Jean,Bella,1920-1929,1926,224,pendant l' arrêt de son pouls . Un dieu,inconnu,,illustrait,,la,"vie de Fontranges . Au retour , Gilbert sentit le"
273,illustrer,40,PROUST Marcel,À la recherche du temps perdu. 19. Le Temps retrouvé,1920-1929,1922,718,"écouter , que le journal cité avait si",péniblement,,illustrée,,pour,"moi , n' était pourtant pas totale . Il y avait en"
274,illustrer,54,COLETTE ,Sido,1920-1929,1929,69,", à sa dernière enfant ... j' aurais",volontiers,,illustré,,ces,pages d' un portrait photographique . Mais il m'
275,illustrer,45,ARAGON Louis,Le Paysan de Paris,1920-1929,1926,769,"Bleu , le Chaperon Rouge et le Loup , c' est toi",qui,,illustres,,alors,Jules Verne et qui transportes par-delà les
276,illustrer,52,COCTEAU Jean,Les Enfants terribles,1920-1929,1929,87,"la strophe superbe , ne se rendant pas compte qu'",elle,,illustrait,,la,chambre et la beauté d' Elisabeth . Elisabeth
277,illustrer,37,PROUST Marcel,À la recherche du temps perdu. 11. Sodome et Gomorrhe,1920-1929,1922,776,de l' hôtel . Il faut qu' elles ne soient pas bien,"""",,illustrées,,"""",pour causer ainsi . à moins qu' on ne les ait
278,illustrer,51,BRETON André,Nadja,1920-1929,1928,142,"ou moins contre mon entreprise , de sorte que la",partie,,illustrée,,de,"Nadja fût , à mon gré , insuffisante : Becque"
279,illustrer,43,DEKOBRA Maurice,La Madone des sleepings,1920-1929,1925,10,"de feu monsieur Jean Lorrain , mais je n' ai",point,,illustré,,mes,"lectures de démonstrations concomitantes , ni"
280,illustrer,53,COCTEAU Jean,Les Enfants terribles,1920-1929,1929,169,révolte bourgeoise d' Agathe ravissait,Elisabeth,",",illustrait,,l',"attitude qu' elle prêtait au jeune ménage ,"
281,illustrer,49,DUHAMEL Georges,Le Journal de Salavin,1920-1929,1927,126,médecins qui nous renverront notre carte,postale,,illustrée,,devront,recevoir ... combien disions -nous ? - nous
282,illustrer,39,PROUST Marcel,À la recherche du temps perdu. 14. La Prisonnière,1920-1929,1922,16,"Paris . Car , selon le code de Françoise tel qu' il",est,,illustré,,dans,"les bas-reliefs de Saint-André-des-Champs ,"
283,illustrer,35,GIRAUDOUX Jean,Siegfried et le Limousin,1920-1929,1922,179,international des gens heureux avec son,supplément,,illustré,,des,"bêtes et des plantes heureuses , et ses"
284,illustrer,50,SOUPAULT Philippe,Le Nègre,1920-1929,1927,30,qu' une lamproie et sur cette noble terre,qu',,illustrent,,les,éclats de rire et le sang du boeuf . Je le regarde
285,illustrer,46,GENEVOIX Maurice,La Boîte à pêche,1920-1929,1926,54,surtout il prêchait d' exemple . Chaque parole,s',,illustrait,,d',un geste . Il continuait : - Je prends mon poisson
286,illustrer,32,PROUST Marcel,À la recherche du temps perdu. 8. Du côté de Guermantes 1,1920-1929,1920,99,"suivi dans sa lettre , mais",naïvement,,illustré,,par,"des détails réels empruntés à la vie locale ,"
287,illustrer,33,PROUST Marcel,À la recherche du temps perdu. 8. Du côté de Guermantes 1,1920-1929,1920,168,"nous avions l' air de nous trouver dans un "" foyer """,qu',,illustraient,,des,"portraits anciens de la troupe , tant les"
288,illustrer,38,PROUST Marcel,À la recherche du temps perdu. 11. Sodome et Gomorrhe,1920-1929,1922,776,"aisément que pureté était dit pour "" puberté "" .","""",,illustrées,,"""",m' embarrassa davantage . Peut-être était -il
289,illustrer,34,MARTIN DU GARD Roger,Les Thibault : Le Pénitencier,1920-1929,1922,769,; elle lui apportait un album plein de,cartes,,illustrées,",",d',"autographes , de fleurs séchées : sa vie de"
290,illustrer,36,GIRAUDOUX Jean,Siegfried et le Limousin,1920-1929,1922,286,sentions que sa mémoire de sculpteur complétait,ou,,illustrait,,l',autre . C' étaient des mains qui avaient beaucoup
291,illustrer,42,COLETTE ,La Maison de Claudine,1920-1929,1922,43,"histoire de jeune fille enlevée ,",séquestrée,",",illustrait,,la,"première page des journaux . Un chemineau ,"
292,illustrer,58,CÉLINE Louis-Ferdinand,Voyage au bout de la nuit,1930-1939,1932,100,s' offrir au plus héroïque d' entre nous . Le,poète,,illustrait,,pieusement,à ce moment -là un fantastique trait de
293,illustrer,82,ROMAINS Jules,Les Hommes de bonne volonté : t. 18 : La Douceur de la vie,1930-1939,1939,41,"de Paris , de la veille , et même une carte",postale,,illustrée,",",représentant,"la cathédrale , que j' enverrai à"
294,illustrer,69,CÉLINE Louis-Ferdinand,Mort à crédit,1930-1939,1936,645,s' apportait exprès là-haut Les Belles,Aventures,,illustrées,.,Il,les lisait pour lui tout seul . Il les étalait sur
295,illustrer,56,CÉLINE Louis-Ferdinand,Voyage au bout de la nuit,1930-1939,1932,66,des dates des principales hécatombes dont elle,fut,,illustrée,,...,C' est tout ce que les hommes ont réussi jusqu' ici
296,illustrer,65,GUILLOUX Louis,Le Sang noir,1930-1939,1935,21,"Fallières , que Maïa avait extrait du Petit",Journal,,illustré,",",c',était un agrandissement que Cripure avait fait
297,illustrer,71,PERRET Jacques,Roucou,1930-1939,1936,53,! Le pouce renversé au-dessus de la bouche,ouverte,,illustra,,l',"étymologie du nom . Bret , qui avait eu un Saramaca du"
298,illustrer,70,PERRET Jacques,Roucou,1930-1939,1936,34,"en main , il esquissa un geste vague que la",fumée,,illustra,,quelques,"instants : il y avait là en puissance , dans"
299,illustrer,63,TZARA Tristan,Faites vos jeux,1930-1939,1934,263,met en désordre les vieilles cartes,postales,,illustrées,",",déchire,son deuil sur le basalte sonore . Je n' ai
300,illustrer,62,MALÈGUE Joseph,Augustin ou le Maître est là : t. 1,1930-1939,1933,69,", des lectures de rencontre , l' étalage des",journaux,,illustrés,,à,"la modern' library , - filles saumon clair et"
301,illustrer,73,ARAGON Louis,Les Beaux quartiers,1930-1939,1936,10,"différents , et que ça a pris plus d' un an à la",mode,,illustrée,,de,"reproduire , même qu' un numéro de juin s' étant"
302,illustrer,77,YOURCENAR Marguerite,Les Vagues [trad.],1930-1939,1937,228,"du rêve . "" J' ai envoyé au directeur du",journal,,illustré,,la,"solution du problème de samedi , se dit le petit"
303,illustrer,66,VAN DER MEERSCH Maxence,Invasion 14,1930-1939,1935,64,"en un journal abondant , épais ,",copieusement,,illustré,",",rehaussé,"d' annonces et de photos suggestives ,"
304,illustrer,81,MONTHERLANT Henry de,Les Lépreuses,1930-1939,1939,1440,", la relégation . Aussi - à cause d' un",livre,,illustré,,de,"son enfance , - les monstrueuses inventions de l'"
305,illustrer,74,ARAGON Louis,Les Beaux quartiers,1930-1939,1936,68,", lui prêta le jardin de Bérénice dans l'",édition,,illustrée,,à,"1 fr. 50 , et la mystique d' Armand devint follement"
306,illustrer,68,CÉLINE Louis-Ferdinand,Mort à crédit,1930-1939,1936,565,marchande sur sa chaufferette Les Belles,Aventures,,illustrées,.,Elle,"me les cachait même dans son froc , sous ses"
307,illustrer,57,CÉLINE Louis-Ferdinand,Voyage au bout de la nuit,1930-1939,1932,99,occasion et le même jour aux envoyés d' un grand,«,,Illustré,,national,» qui nous photographia tous ensemble sur
308,illustrer,75,ARAGON Louis,Les Beaux quartiers,1930-1939,1936,294,mais dont il avait lu la tétralogie dans l',édition,,illustrée,,d',"Hachette . Puis il y avait le fils Cotin , de"
309,illustrer,78,DUHAMEL Georges,Chronique des Pasquier. 7. Cécile parmi nous,1930-1939,1938,49,exagéré de dire pathétique . Connaissez -vous,l',,illustre,,Monsieur,"Noël Chérouvier . Il n' y a pas à dire , c' est"
310,illustrer,59,ROMAINS Jules,Les Hommes de bonne volonté : t. 1 : Le 6 octobre,1930-1939,1932,283,des oeuvres complètes . Les éditions,populaires,,illustrées,.,Les,"poètes . Les romanciers . Les penseurs . - ça ,"
311,illustrer,55,COHEN Albert,Solal,1930-1939,1930,194,", son mariage , son écurie de courses et les",revues,,illustrées,,feraient,"le reste . Solal , lui , n' avait que Solal . Il"
312,illustrer,109,BAZIN Hervé,La Tête contre les murs,1940-1949,1949,146,n' y a pas assez de patères . La moitié des torses,sont,,illustrés,:,généralement,avec un goût déplorable . Un
313,illustrer,92,CENDRARS Blaise,L'Homme foudroyé,1940-1949,1945,399,"à gauche , et , à droite , que des ouvrages",érotiques,,illustrés,,...,Roulure ! ... Je renâclais comme une bête en
314,illustrer,90,TRIOLET Elsa,Le Premier accroc coûte deux cents francs,1940-1949,1945,59,préau d' école pendant la classe . Une,vespasienne,,illustrée,,de,"réclames en occupait le milieu , telle une"
315,illustrer,102,GENET Jean,Notre-Dame-des-fleurs,1940-1949,1948,49,douceurs . De vieux journaux de mode traînaient,là,",",illustrés,,de,gravures où les femmes de 1910 avaient toujours un
316,illustrer,97,FALLET René,Banlieue Sud-Est,1940-1949,1947,235,"banque , sur toute la longueur de l' Histoire de",France,,illustrée,,par,"Paulin et Dessertenne , revue et corrigée par"
317,illustrer,84,NÉMIROVSKY Irène,Suite française,1940-1949,1942,238,"» D' autres , par des caricatures ou des",graphiques,",",illustraient,,la,domination anglaise dans le monde et la tyrannie
318,illustrer,101,GENET Jean,Notre-Dame-des-fleurs,1940-1949,1948,46,"les intérieurs dorés , à travers la",guipure,,illustrée,,de,"motifs travaillés : fleurs , feuilles d' acanthe ,"
319,illustrer,107,BERNANOS Georges,Un mauvais rêve,1940-1949,1948,924,", prenant naïvement l' attitude connue du",public,",",illustrée,,par,"tant de photographies . - après tout , je m' en"
320,illustrer,100,GENET Jean,Notre-Dame-des-fleurs,1940-1949,1948,10,"et de cour , j' ai cueilli çà et là , sur la",couverture,,illustrée,,de,"quelques romans d' aventures , un jeune métis"
321,illustrer,86,GUILLOUX Louis,Le Pain des rêves,1940-1949,1942,354,"et Filochard - , de petits livrets non moins",vivement,,illustrés,:,Nick,"Carter , Buffalo - Bill , les Aventures d' un"
322,illustrer,111,COLETTE ,La vagabonde,1940-1949,1949,153,bureau genre anglais que j' ai déjà vu tant de,fois,",",illustré,,de,"photographies étrangères : dames en buste ,"
323,illustrer,91,VAILLAND Roger,Drôle de jeu,1940-1949,1945,97,"penser , dit Marat , à une image d' un grand",livre,,illustré,,sur,Bonaparte que j' ai eu comme prix d' excellence (
324,illustrer,93,CENDRARS Blaise,L'Homme foudroyé,1940-1949,1945,455,régulièrement . Je lui envoie des cartes,postales,,illustrées,",",les,photos des saints de nos cathédrales et tout ce
325,illustrer,110,BAZIN Hervé,La Tête contre les murs,1940-1949,1949,345,dit à ce sujet : nous n' y reviendrons pas . Mais rien,n',,illustre,,mieux,la manière dont le répressif se confond avec le
326,illustrer,98,GENET Jean,Miracle de la rose,1940-1949,1947,38,", qui en escaladait les rochers dans les",pages,,illustrées,,de,mon enfance . Les transports furent finis . Les
327,illustrer,94,CENDRARS Blaise,L'Homme foudroyé,1940-1949,1945,482,"des romans , des vrais romans . C' est ainsi que j'",ai,,illustré,,Mr.,"Pickwick de Dickens et , après mon deuxième"
328,illustrer,105,GENET Jean,Notre-Dame-des-fleurs,1940-1949,1948,219,"Le Bêcheur . » Dans cette séance solennelle ,",il,,illustrait,,fort,justement une pancarte clouée à une porte
329,illustrer,112,MALET Léo,Le Soleil n'est pas pour nous,1940-1949,1949,119,"tombé sur cet article concernant le mildiou ,",qu',,illustrait,,une,"jolie feuille de vigne , une feuille de vigne"
330,illustrer,104,GENET Jean,Notre-Dame-des-fleurs,1940-1949,1948,216,les femmes du village galiléen . La beauté de,Marie,,illustrait,,le,bourg . être la mère humaine d' une divinité est
331,illustrer,113,MALET Léo,Le Soleil n'est pas pour nous,1940-1949,1949,139,"ajusté , reposait sur un vieux Petit",Journal,,illustré,.,Une,"affiche , placardée à la tête du lit , conviait"
332,illustrer,114,ZOBEL Joseph,La Rue Cases-Nègres,1950-1959,1950,226,est basse . Alors tu enverras une belle carte,postale,,illustrée,,à,"m' man Tine . Je n' en eus point de chagrin , car ma"
333,illustrer,115,GENEVOIX Maurice,Ceux de 14,1950-1959,1950,378,", une image coloriée , première page d' un",journal,,illustré,,daté,"de 98 , représente un dompteur dévoré par ses"
334,illustrer,116,NIMIER Roger,Le Hussard bleu,1950-1959,1950,192,tout d' un coup transporté dans un grand Jules,Verne,,illustré,",",ses,"traits un peu affadis par un dessinateur de 1890 ,"
335,illustrer,117,FALLET René,Le Triporteur,1950-1959,1951,28,qui n' aimait pas les pauvres et s',était,,illustré,,à,"Verdun . Où il avait pris , dans les années vingt ,"
336,illustrer,118,VIALATTE Alexandre,Les Fruits du Congo,1950-1959,1951,164,", la flamme baissée , coiffée d' un",abat-jour,,illustré,,de,scènes . humoristiques qui retraçaient la vie du
337,illustrer,119,BAZIN Hervé,Le Bureau des mariages,1950-1959,1951,51,Julie ou à Marguerite des propositions,précises,",",illustrées,,par,de solides esquisses anatomiques . Une
338,illustrer,120,GIBEAU Yves,Allons z'enfants,1950-1959,1952,160,s' agissait -il d' un roman d' aventures,superbement,,illustré,,...,Du Vicomte de Bragelonne ? Du Dernier des Mohicans
339,illustrer,121,ROBBE-GRILLET Alain,Les Gommes,1950-1959,1952,236,avec son coupe-papier . C' est une carte,postale,,illustrée,",",qui,représente une petite maison de faux style
340,illustrer,122,MERLE Robert,La Mort est mon Métier,1950-1959,1952,175,des camarades et des chefs des Corps francs,s',,illustraient,,dans,"la résistance , notamment le Lieutenant Leo"
341,illustrer,123,VIAN Boris,L'Arrache-cœur,1950-1959,1953,192,"? Il faudrait un gros livre , sur papier",couché,,illustré,,d',"eaux-fortes en couleurs , dues au burin fertile de"
342,illustrer,124,SIMONIN Albert,Touchez pas au grisbi,1950-1959,1953,47,pouvait rivaliser ; mais c' était quand même,moins,,illustré,.,Sur,"les photos de Frédo , les bourres avaient dû en"
343,illustrer,125,DUVIGNAUD Jean,L'Or de La République,1950-1959,1957,16,", dit Rufus , que cette troupe et son",recrutement,,illustrent,,la,décadence de notre vieux monde . Je ne dis pas qu' un
344,illustrer,126,BUTOR Michel,La Modification,1950-1959,1957,222,murs de chaque côté de la fenêtre comme celles,qui,,illustrent,,ce,"compartiment , cette chambre provisoire et"
345,illustrer,127,SIMON Claude,L'Herbe,1950-1959,1958,159,", comme dans ces tableaux reproduits dans les",pages,,illustrées,,du,Petit Larousse représentant un de ces épisodes
346,illustrer,128,GIONO Jean,Hortense,1950-1959,1958,825,un dragon pour la première page du Petit,Journal,,illustré,.,Les,deux hommes firent une longue promenade au bord
347,illustrer,129,GIONO Jean,Hortense,1950-1959,1958,852,» concernant ces projets ; elle,était,,illustrée,,de,"schémas et de croquis . Il délimita , sur le"
348,illustrer,130,SIMONIN Albert,Du mouron pour les petits oiseaux,1960-1969,1960,273,", ça t' aurait semblé pas croyable ! Inutile qu'",il,,illustre,,plus,"clairement sa gamberge le lardu , Armand entrave ."
349,illustrer,131,SOLLERS Philippe,Le parc,1960-1969,1961,107,. C' était un livre jaune à couverture,cartonnée,",",illustré,,de,dessins très simples ; éléments familiers et
350,illustrer,132,MAC ORLAN Pierre,Sous la lumière froide,1960-1969,1961,59,on travaille sur du papier blanc . J' avais,déjà,,illustré,,sans,"fantaisie quelques ouvrages populaires , quand"
351,illustrer,133,CLAVEL Bernard,La Maison des autres,1960-1969,1962,311,"pour le montrer aux autres , il ajouta : - Et c'",est,,illustré,.,Vous,pouvez voir . Toujours la même greluche !
352,illustrer,134,CABANIS José,Les Jeux de la nuit,1960-1969,1964,13,"lui parlais de ce voyage aux pyrénées , qu' il",avait,,illustré,",",où,"il y a des ravins , des grottes , des ruines , des"
353,illustrer,135,PEREC Georges,Les Choses,1960-1969,1965,15,"de maillechort et de carton bouilli ,",naïvement,,illustrée,",",faussement,"ancienne . Derrière le bureau , à demi"
354,illustrer,136,DUCHARME Réjean,L'avalée des avalés,1960-1969,1966,333,"l' habit d' un soldat qui meurt à ses pieds , se bat et",s',,illustre,.,Il,est de nouveau arrêté . Il refuse de dire qui il est
355,illustrer,137,SABATIER Robert,Le Chinois d'Afrique,1960-1969,1966,315,recollée avec du papier kraft gommé . L',insanité,,illustrée,,d',un phallus . L' amoncellement des draps sales . L'
356,illustrer,138,MONESI Irène,Nature morte devant la fenêtre,1960-1969,1966,117,"comme un signe infamant , un mot de Saint-Just",qui,,illustrait,,son,"isolement : "" Un peuple qui n' est pas heureux n' a"
357,illustrer,139,GIONO Jean,Le Déserteur,1960-1969,1966,195,"de Paris , journal de littérature",amusante,",",illustré,,de,"très belles gravures » , publie , dans son"
358,illustrer,140,LE CLÉZIO Jean-Marie Gustave,Le Déluge,1960-1969,1966,158,"de la femme rousse . En chemin , il acheta un",journal,,illustré,,pour,le petit garçon . Il arriva à temps pour le
359,illustrer,141,GIRAUD Robert,La Coupure,1960-1969,1966,160,", un article de cette importance , en première page",et,,illustré,,par,"un dessin , mon Dieu , ça va chercher dans les"
360,illustrer,142,DUTOURD Jean,Pluche ou l'amour de l'art,1960-1969,1967,32,"ennui ou du souci , je l' ai payé au poids de l' or . Rien",n',,illustre,,mieux,mon propos que les soirées dans les boîtes de
361,illustrer,143,BAZIN Hervé,Le Matrimoine,1960-1969,1967,14,. Quelques CC ( nous ne faisions pas de miracles,),,illustrent,,ailleurs,"les corps à corps . Quant à la note , elle"
362,illustrer,144,BAZIN Hervé,Le Matrimoine,1960-1969,1967,169,", de polos , de slips nains , de bavettes en",éponge,,illustrées,,de,"fables , de mi-bas , de socquettes , de mulettes , de"
363,illustrer,145,GROULT Benoîte,Il était deux fois,1960-1969,1968,148,tard en feuilletant avec elle des revues,médicales,,illustrées,,d',admirables maladies en couleurs qui la
364,illustrer,146,PEREC Georges,La Disparition,1960-1969,1969,85,", 8 Où l'on dira trois mots d' un tumulus où Trajan",s',,illustra,",",JOURNAL,D' ANTON VOYL Un lundi . 8 Où l'on dira trois
365,illustrer,147,PEREC Georges,La Disparition,1960-1969,1969,85,. 8 Où l'on dira trois mots d' un tumulus où Trajan,s',,illustra,,JOURNAL,"D' ANTON VOYL Un lundi . Oui , il y a aussi Ismaïl"
366,illustrer,186,PEREC Georges,La Vie mode d'emploi : romans,1970-1979,1978,47,qu' il avait sculpté lui -même et dont les,motifs,,illustraient,,les,scènes capitales de L' île mystérieuse : la
367,illustrer,187,PEREC Georges,La Vie mode d'emploi : romans,1970-1979,1978,101,. Elle feuillette avec indifférence un,magazine,,illustré,,sur,la couverture duquel on voit un chanteur de charme
368,illustrer,188,PEREC Georges,La Vie mode d'emploi : romans,1970-1979,1978,116,"fameux , « Sherwood's put you in the mood »",et,,illustrée,,par,des vignettes hexagonales représentant un
369,illustrer,191,PEREC Georges,La Vie mode d'emploi : romans,1970-1979,1978,335,"de cette affiche , Elzbieta Orlowska répond qu'",elle,,illustre,,une,"comptine très populaire en Pologne , où elle sert"
370,illustrer,148,TOURNIER Michel,Le Roi des Aulnes,1970-1979,1970,133,", le géant Porte-Christ , de même qu' elle",était,,illustrée,,par,"la légende d' Albuquerque , de même encore qu'"
371,illustrer,167,TOURNIER Michel,Les Météores,1970-1979,1975,524,du quiétisme de Mme Guyon au XVIIe,siècle,,illustrent,,bien,le mépris où l' Occident tient les valeurs qui
372,illustrer,199,ROY Claude,La Traversée du Pont des Arts,1970-1979,1979,57,"Charles était orphelin . Il y avait , dans les",pages,,illustrées,,de,"son dictionnaire , la reproduction d' un tableau"
373,illustrer,153,MODIANO Patrick,Les Boulevards de ceinture,1970-1979,1972,35,de jeunes personnes très,déshabillées,",",illustrent,,cet,"article . En seconde page , les « échos"
374,illustrer,161,ORMESSON Jean d',Au plaisir de Dieu,1970-1979,1974,276,", ignorés de mon grand-père mais chantés",et,,illustrés,,par,Valery Larbaud : les moyens de communication . Le
375,illustrer,152,SABATIER Robert,Trois sucettes à la menthe,1970-1979,1972,117,apporta une pile d' assiettes à bords,dentelés,",",illustrées,,de,charades . Elle dut les poser sur une desserte car
376,illustrer,182,SIMONIN Albert,Confessions d'un enfant de la Chapelle,1970-1979,1977,100,"; cornets de frites , glaces , places de",ciné,",",illustrés,",",cigarettes,"anglaises . Pour moi , le gros problème"
377,illustrer,170,MODIANO Patrick,Villa Triste,1970-1979,1975,118,rue de notre ville porte son nom . » Une grande,photo,,illustrait,,l',"article . Elle avait été prise au Sainte-Rose ,"
378,illustrer,166,TOURNIER Michel,Les Météores,1970-1979,1975,406,", c' est grâce à des créatures de ce genre .",Méline,,illustrait,,bien,le mélange d' intelligence aiguë mais bornée
379,illustrer,181,MANCHETTE Jean-Patrick,Fatale,1970-1979,1977,22,( Aimée interrompit ici sa lecture . La page,était,,illustrée,,d',une gravure représentant la jetée et le phare que
380,illustrer,195,MODIANO Patrick,Rue des Boutiques Obscures,1970-1979,1978,220,jockey anglais André Wildmer . » Quelques,photos,,illustraient,,l',"article parmi lesquelles une photo de Wildmer ,"
381,illustrer,183,SIMONIN Albert,Confessions d'un enfant de la Chapelle,1970-1979,1977,109,catégoriquement de préciser les lieux où,s',,illustraient,,les,grivetons de qui on lui réclamait des nouvelles
382,illustrer,193,PEREC Georges,La Vie mode d'emploi : romans,1970-1979,1978,657,", La , périodique illustré , 308 . Petit",Larousse,,illustré,",",Le,", dictionnaire , 204 . Petit - Pouce , chat des"
383,illustrer,151,BAZIN Hervé,Cri de la chouette,1970-1979,1972,274,attendrir il faut encore qu' elle glousse . Un aveu,l',,illustrait,:,Faut,"pouvoir ... Je n' aimais pas du tout , au"
384,illustrer,173,CHABROL Jean-Pierre,La Folie des miens,1970-1979,1977,14,"il était zéro , il n' avait rien à décider , lui ,",il,,illustrait,",",c',"est tout . Quoique , fut un temps où même l' art ..."
385,illustrer,172,MANCHETTE Jean-Patrick,Trois hommes à abattre : le petit bleu de la côte ouest,1970-1979,1976,109,". Vieux meubles , lit de fer . Un calendrier des",postes,,illustré,,d',une vue des Champs-Élysées la nuit . Sur une
386,illustrer,233,MERTENS Pierre,Les Éblouissements,1980-1989,1987,353,"les idéaux des Lumières , et l' imposture où",s',,illustrait,,une,époque qui ne voulait rien savoir du caractère
387,illustrer,243,SIMON Claude,L'Acacia,1980-1989,1989,19,", la femme essayait de le faire lire dans un",album,,illustré,,d',"animaux de ferme , puis renonçait , se mettait"
388,illustrer,211,LABRO Philippe,Des bateaux dans la nuit,1980-1989,1982,99,", du conseil financier , du",livre,,illustré,,pour,"enfants , du restaurant diététique , de la"
389,illustrer,218,THÉRAME Victoria,Bastienne,1980-1989,1985,48,"partage entre ses cultures , ses herbiers , ses",livres,,illustrés,,sur,"les peuples primitifs , les flores exotiques et"
390,illustrer,209,BEAUCHEMIN Yves,Le Matou,1980-1989,1981,293,mettre la main sur un livre rarissime : la,biographie,,illustrée,,de,"mon maître spirituel , le grand cuisinier Alexis"
391,illustrer,231,MERTENS Pierre,Les Éblouissements,1980-1989,1987,68,"de fierté , celle d' appartenir à l' espèce qui",s',,illustrait,,par,"cette surenchère de formes , de volumes et de"
392,illustrer,217,BIANCIOTTI Hector,Sans la miséricorde du Christ,1980-1989,1985,319,"soir . Je lui apportais des livres , entre autres l'",un,",",illustré,",",qui,avait trait à l' architecture française du
393,illustrer,227,ORMESSON Jean d',Tous les hommes sont fous,1980-1989,1986,325,"espagnol moyen , déclarait devant un",document,,illustré,,par,une carte qu' il retournait en tous sens : « Un
394,illustrer,228,SOLLERS Philippe,Le Cœur absolu,1980-1989,1987,384,... - Ce n' est pas grave . On pourrait faire un,livre,,illustré,,...,"- Vous pensez ? - Mais oui . Un livre de vous , d'"
395,illustrer,219,MANŒUVRE Philippe,L'Enfant du rock,1980-1989,1985,39,"volumes dont les jaquettes , déjà ,",étaient,,illustrées,,par,"le génial Moebius ... à force de lire de la SF , je"
