ID select,verbe,id Frantext,auteur,titre,intervale tps,date,page,ctx gauche,mot gauche,ponct G,pivot,ponct D,mot droit,ctx droit
396,illustrer,222,ORMESSON Jean d',Le Vent du soir,1980-1989,1985,238,. Il n' y a que le nom ... Mais celui des,Romero,",",illustré,,par,"le père bien-aimé et trop tôt disparu , par le"
397,illustrer,207,MORDILLAT Gérard,Vive la Sociale !,1980-1989,1981,91,de copropriété de son immeuble . Le Petit,Larousse,,illustré,,en,commençant par la lettre A. Tous les cent
398,illustrer,220,QUEFFÉLEC Yann,Les Noces barbares,1980-1989,1985,252,était glissé entre verre et,soucoupe,",",illustré,,de,femmes nues . Le patron lui lança un clin d' oeil de
399,illustrer,230,BAYON ,Le Lycéen,1980-1989,1987,129,ses leçons étaient d' ailleurs,pertinemment,,illustrées,,d',"exemples précis : les bottes comme Untel , la"
400,illustrer,240,PENNAC Daniel,La Petite marchande de prose,1980-1989,1989,145,admirables . J' en prévois une nouvelle série,qui,,illustrera,,le,"premier papier vous concernant . Vous verrez , vous"
401,illustrer,215,DORIN Françoise,Les jupes-culottes,1980-1989,1984,394,"des deux protagonistes . La femme , Chantal ,",s',,illustre,,comme,journaliste politique dans un hebdomadaire à
402,illustrer,244,SIMON Claude,L'Acacia,1980-1989,1989,113,entière du cadastre de la commune portait le,nom,,illustré,,à,la tête d' armées de la Révolution puis de l'
403,illustrer,238,MOHRT Michel,Vers l'Ouest,1980-1989,1988,194,"éditions , éditions courantes , éditions de",luxe,,illustrées,",",pages,choisies ... Il comptabilisait les
404,illustrer,239,BECK Béatrix,Stella Corfou,1980-1989,1988,102,"qui , digne , ne semble pas s' en apercevoir . Créent",et,,illustrent,,le,mot cabrioles . Les arbres de l' avenue viennent d'
405,illustrer,223,GARAT Anne-Marie,Voie non classée,1980-1989,1985,170,et que la grand-mère gardait pieusement . Il,était,,illustré,,d',"images désuètes , peut-être de cette époque"
406,illustrer,262,ROLIN Jean,L'Organisation,1990-1999,1996,81,"un flic ne sortira vivant de Paris insurgé ! » ,",et,,illustré,,par,"un dessin représentant un flic étendu ,"
407,illustrer,266,RAMBAUD Patrick,La Bataille,1990-1999,1997,14,"par ce fou furieux d' Augereau , s' était",autrefois,,illustrée,,en,franchissant le pont d' Arcole . C' était Masséna
408,illustrer,253,SOLLERS Philippe,Le Secret,1990-1999,1993,221,", de lire un gros livre plein d' intérêt , très",bien,,illustré,",",intitulé,Folie et surréalisme : il commence par
409,illustrer,248,GARAT Anne-Marie,Chambre noire,1990-1999,1990,120,"transportable , sorte de dictionnaire",médical,,illustré,",",occupe,"l' arrière de son fourgon , il se déploie"
410,illustrer,257,LANZMANN Jacques,La Horde d'or,1990-1999,1994,238,de quels affrontements son passager s' était si,bien,,illustré,.,Et,Gontran d' inverser l' ordre des choses en
411,illustrer,258,CHANDERNAGOR Françoise,L'Enfant des Lumières,1990-1999,1995,44,une famille dont tant d' aïeux s',étaient,,illustrés,.,De,"la naissance d' Alexis , elle avait été"
412,illustrer,250,BAZIN Hervé,L'école des pères,1990-1999,1991,67,"de l' alouette » : la lecture d' un texte ,",joliment,,illustré,",",utilisant,des caractères de taille
413,illustrer,251,CHAMOISEAU Patrick,Texaco,1990-1999,1992,32,- Cirique avait déclaré un jour qu' au vu du,Larousse,,illustré,",",nous,étions — en français — une communauté .
414,illustrer,247,GARAT Anne-Marie,Chambre noire,1990-1999,1990,119,"sortes de dé pliants explicatifs , des",panneaux,,illustrés,,à,"usage local , pour l' affichage et la distribution ."
415,illustrer,270,JONQUET Thierry,Moloch,1990-1999,1998,318,"promis , il y fit l' acquisition d' une",biographie,,illustrée,,de,"Munch , parue aux éditions Flammarion , et due à un"
416,illustrer,256,LANZMANN Jacques,La Horde d'or,1990-1999,1994,179,"et l' Afghanistan . Plus tard , Tengri s'",était,,illustré,,en,"permettant à Batu , petit-fils de Gengis , de"
417,illustrer,263,SCHREIBER Boris,Un silence d'environ une demi-heure,1990-1999,1996,39,. Ne s' agissait -il pas du Petit,Larousse,,illustré,?,Laquelle,de nos expressions serait choisie pour l'
418,illustrer,267,ECHENOZ Jean,Un an,1990-1999,1997,13,elles pour étudier les locations . Chaque,annonce,,illustrée,,d',"une photo proposait un décor de téléfilm , un"
419,illustrer,269,DESPLECHIN Marie,Sans moi,1990-1999,1998,222,", un album qui avait appartenu à mon grand-père",et,,illustrait,,les,saisons . Je remis la main sur une enveloppe pleine
420,illustrer,254,ORSENNA Erik,Grand amour,1990-1999,1993,31,"est entré sans lever la tête , plongé dans un",livre,,illustré,,sur,"la vie des fourmis , Frédérique a suivi ,"
421,illustrer,265,IZZO Jean-Claude,Chourmo,1990-1999,1996,272,"- Ouais , évidemment . - Ton Narni , il s' est",surtout,,illustré,,pendant,des années comme patron du racket sur toute
422,illustrer,268,DORIN Françoise,Les Vendanges tardives,1990-1999,1997,126,", non ! Deux bons gros chaussons . Ils enchâssent",et,,illustrent,,le,nom de la maison : « les Charentaises » . Re-stop
423,illustrer,249,MONFERRAND Hélène de,Journal de Suzanne,1990-1999,1991,27,"avec méfiance ce journal trop coloré ,",trop,,illustré,",",où,les petites filles portaient des robes trop
424,illustrer,252,GERMAIN Sylvie,La Pleurante des rues de Prague,1990-1999,1992,116,"de toute gloire , celle qu' on n' écrit pas , qu' on",n',,illustre,,ni,ne chante ni ne dore à l' or étincelant des mythes et
425,illustrer,260,ROLIN Jean,L'Organisation,1990-1999,1996,24,"la charge de nous exhorter ce jour -là , s'",était,,illustré,,en,concluant son petit discours par une citation
